{
  "$schema": "https://json-schema.org/draft/2020-12/schema",
  "type": "object",
  "properties": {
    "schemaVersion": {
      "type": "number",
      "const": 1
    },
    "revision": {
      "type": "integer",
      "exclusiveMinimum": 0,
      "maximum": 9007199254740991
    },
    "id": {
      "type": "string",
      "pattern": "^[a-z0-9]+(?:-[a-z0-9]+)*$"
    },
    "title": {
      "type": "string"
    },
    "subject": {
      "type": "string"
    },
    "year": {
      "anyOf": [
        {
          "type": "integer",
          "minimum": 1900,
          "maximum": 2200
        },
        {
          "type": "null"
        }
      ]
    },
    "division": {
      "type": "string"
    },
    "description": {
      "type": "string"
    },
    "tags": {
      "type": "array",
      "items": {
        "type": "string"
      }
    },
    "images": {
      "type": "array",
      "items": {
        "type": "object",
        "properties": {
          "src": {
            "type": "string",
            "pattern": "^media\\/(?:[a-zA-Z0-9_-]+\\/)*[a-zA-Z0-9_-]+\\.(?:png|jpg|jpeg|webp|gif|avif)$"
          },
          "alt": {
            "type": "string"
          },
          "caption": {
            "type": "string"
          }
        },
        "required": [
          "src",
          "alt"
        ],
        "additionalProperties": false
      }
    },
    "settings": {
      "type": "object",
      "properties": {
        "questionOrder": {
          "type": "string",
          "const": "fixed"
        },
        "feedback": {
          "type": "string",
          "const": "after-finish"
        }
      },
      "required": [
        "questionOrder",
        "feedback"
      ],
      "additionalProperties": false
    },
    "sections": {
      "type": "array",
      "items": {
        "type": "object",
        "properties": {
          "id": {
            "type": "string",
            "pattern": "^[a-z0-9]+(?:-[a-z0-9]+)*$"
          },
          "title": {
            "type": "string"
          }
        },
        "required": [
          "id",
          "title"
        ],
        "additionalProperties": false
      }
    },
    "groups": {
      "type": "array",
      "items": {
        "type": "object",
        "properties": {
          "id": {
            "type": "string",
            "pattern": "^[a-z0-9]+(?:-[a-z0-9]+)*$"
          },
          "title": {
            "type": "string"
          },
          "context": {
            "type": "array",
            "items": {
              "$ref": "#/$defs/__schema0"
            }
          },
          "images": {
            "type": "array",
            "items": {
              "type": "object",
              "properties": {
                "src": {
                  "type": "string",
                  "pattern": "^media\\/(?:[a-zA-Z0-9_-]+\\/)*[a-zA-Z0-9_-]+\\.(?:png|jpg|jpeg|webp|gif|avif)$"
                },
                "alt": {
                  "type": "string"
                },
                "caption": {
                  "type": "string"
                }
              },
              "required": [
                "src",
                "alt"
              ],
              "additionalProperties": false
            }
          }
        },
        "required": [
          "id",
          "title",
          "context",
          "images"
        ],
        "additionalProperties": false
      }
    },
    "provenance": {
      "anyOf": [
        {
          "type": "object",
          "properties": {
            "sourceFile": {
              "type": "string"
            },
            "sourceCommit": {
              "type": "string",
              "pattern": "^[a-f0-9]{40}$"
            },
            "sourceSha256": {
              "type": "string",
              "pattern": "^[a-fA-F0-9]{64}$"
            },
            "notes": {
              "type": "array",
              "items": {
                "type": "string"
              }
            }
          },
          "required": [
            "sourceFile",
            "sourceCommit",
            "notes"
          ],
          "additionalProperties": false
        },
        {
          "type": "object",
          "properties": {
            "sourceFile": {
              "type": "string"
            },
            "sourceCommit": {
              "type": "string",
              "pattern": "^[a-f0-9]{40}$"
            },
            "sourceSha256": {
              "type": "string",
              "pattern": "^[a-fA-F0-9]{64}$"
            },
            "notes": {
              "type": "array",
              "items": {
                "type": "string"
              }
            }
          },
          "required": [
            "sourceFile",
            "sourceSha256",
            "notes"
          ],
          "additionalProperties": false
        }
      ]
    },
    "questions": {
      "minItems": 1,
      "type": "array",
      "items": {
        "oneOf": [
          {
            "type": "object",
            "properties": {
              "id": {
                "type": "string",
                "pattern": "^[a-z0-9]+(?:-[a-z0-9]+)*$"
              },
              "label": {
                "type": "string"
              },
              "sectionId": {
                "type": "string",
                "pattern": "^[a-z0-9]+(?:-[a-z0-9]+)*$"
              },
              "groupId": {
                "type": "string",
                "pattern": "^[a-z0-9]+(?:-[a-z0-9]+)*$"
              },
              "category": {
                "type": "string"
              },
              "statement": {
                "type": "array",
                "items": {
                  "$ref": "#/$defs/__schema0"
                }
              },
              "context": {
                "type": "array",
                "items": {
                  "$ref": "#/$defs/__schema0"
                }
              },
              "explanation": {
                "type": "array",
                "items": {
                  "$ref": "#/$defs/__schema0"
                }
              },
              "images": {
                "type": "array",
                "items": {
                  "type": "object",
                  "properties": {
                    "src": {
                      "type": "string",
                      "pattern": "^media\\/(?:[a-zA-Z0-9_-]+\\/)*[a-zA-Z0-9_-]+\\.(?:png|jpg|jpeg|webp|gif|avif)$"
                    },
                    "alt": {
                      "type": "string"
                    },
                    "caption": {
                      "type": "string"
                    }
                  },
                  "required": [
                    "src",
                    "alt"
                  ],
                  "additionalProperties": false
                }
              },
              "tags": {
                "type": "array",
                "items": {
                  "type": "string"
                }
              },
              "type": {
                "type": "string",
                "const": "multiple-choice"
              },
              "options": {
                "minItems": 2,
                "type": "array",
                "items": {
                  "type": "object",
                  "properties": {
                    "id": {
                      "type": "string",
                      "pattern": "^[a-z0-9]+(?:-[a-z0-9]+)*$"
                    },
                    "text": {
                      "type": "array",
                      "items": {
                        "$ref": "#/$defs/__schema0"
                      }
                    }
                  },
                  "required": [
                    "id",
                    "text"
                  ],
                  "additionalProperties": false
                }
              },
              "correctAnswer": {
                "type": "string",
                "pattern": "^[a-z0-9]+(?:-[a-z0-9]+)*$"
              }
            },
            "required": [
              "id",
              "label",
              "category",
              "statement",
              "explanation",
              "images",
              "tags",
              "type",
              "options",
              "correctAnswer"
            ],
            "additionalProperties": false
          },
          {
            "type": "object",
            "properties": {
              "id": {
                "type": "string",
                "pattern": "^[a-z0-9]+(?:-[a-z0-9]+)*$"
              },
              "label": {
                "type": "string"
              },
              "sectionId": {
                "type": "string",
                "pattern": "^[a-z0-9]+(?:-[a-z0-9]+)*$"
              },
              "groupId": {
                "type": "string",
                "pattern": "^[a-z0-9]+(?:-[a-z0-9]+)*$"
              },
              "category": {
                "type": "string"
              },
              "statement": {
                "type": "array",
                "items": {
                  "$ref": "#/$defs/__schema0"
                }
              },
              "context": {
                "type": "array",
                "items": {
                  "$ref": "#/$defs/__schema0"
                }
              },
              "explanation": {
                "type": "array",
                "items": {
                  "$ref": "#/$defs/__schema0"
                }
              },
              "images": {
                "type": "array",
                "items": {
                  "type": "object",
                  "properties": {
                    "src": {
                      "type": "string",
                      "pattern": "^media\\/(?:[a-zA-Z0-9_-]+\\/)*[a-zA-Z0-9_-]+\\.(?:png|jpg|jpeg|webp|gif|avif)$"
                    },
                    "alt": {
                      "type": "string"
                    },
                    "caption": {
                      "type": "string"
                    }
                  },
                  "required": [
                    "src",
                    "alt"
                  ],
                  "additionalProperties": false
                }
              },
              "tags": {
                "type": "array",
                "items": {
                  "type": "string"
                }
              },
              "type": {
                "type": "string",
                "const": "essay"
              },
              "modelAnswer": {
                "type": "array",
                "items": {
                  "$ref": "#/$defs/__schema0"
                }
              }
            },
            "required": [
              "id",
              "label",
              "category",
              "statement",
              "explanation",
              "images",
              "tags",
              "type",
              "modelAnswer"
            ],
            "additionalProperties": false
          }
        ]
      }
    }
  },
  "required": [
    "schemaVersion",
    "revision",
    "id",
    "title",
    "subject",
    "year",
    "division",
    "description",
    "tags",
    "images",
    "settings",
    "sections",
    "groups",
    "provenance",
    "questions"
  ],
  "additionalProperties": false,
  "$defs": {
    "__schema0": {
      "oneOf": [
        {
          "type": "object",
          "properties": {
            "type": {
              "type": "string",
              "const": "text"
            },
            "text": {
              "type": "string"
            }
          },
          "required": [
            "type",
            "text"
          ],
          "additionalProperties": false
        },
        {
          "type": "object",
          "properties": {
            "type": {
              "type": "string",
              "const": "element"
            },
            "tag": {
              "type": "string",
              "enum": [
                "b",
                "strong",
                "i",
                "em",
                "u",
                "s",
                "sub",
                "sup",
                "br",
                "p",
                "div",
                "span",
                "ul",
                "ol",
                "li",
                "table",
                "thead",
                "tbody",
                "tr",
                "th",
                "td"
              ]
            },
            "children": {
              "type": "array",
              "items": {
                "$ref": "#/$defs/__schema0"
              }
            }
          },
          "required": [
            "type",
            "tag",
            "children"
          ],
          "additionalProperties": false
        }
      ]
    }
  }
}
